{
  "projectName": "Pongifi",
  "width": 120,
  "banner": [
    "\u2588\u2588\u2588\u2588\u2588\u2588\u2557  \u2588\u2588\u2588\u2588\u2588\u2588\u2557 \u2588\u2588\u2588\u2557   \u2588\u2588\u2557 \u2588\u2588\u2588\u2588\u2588\u2588\u2557 \u2588\u2588\u2557\u2588\u2588\u2588\u2588\u2588\u2588\u2588\u2557\u2588\u2588\u2557",
    "\u2588\u2588\u2554\u2550\u2550\u2588\u2588\u2557\u2588\u2588\u2554\u2550\u2550\u2550\u2588\u2588\u2557\u2588\u2588\u2588\u2588\u2557  \u2588\u2588\u2551\u2588\u2588\u2554\u2550\u2550\u2550\u2550\u255d \u2588\u2588\u2551\u2588\u2588\u2554\u2550\u2550\u2550\u2550\u255d\u2588\u2588\u2551",
    "\u2588\u2588\u2588\u2588\u2588\u2588\u2554\u255d\u2588\u2588\u2551   \u2588\u2588\u2551\u2588\u2588\u2554\u2588\u2588\u2557 \u2588\u2588\u2551\u2588\u2588\u2551  \u2588\u2588\u2588\u2557\u2588\u2588\u2551\u2588\u2588\u2588\u2588\u2588\u2557  \u2588\u2588\u2551",
    "\u2588\u2588\u2554\u2550\u2550\u2550\u255d \u2588\u2588\u2551   \u2588\u2588\u2551\u2588\u2588\u2551\u255a\u2588\u2588\u2557\u2588\u2588\u2551\u2588\u2588\u2551   \u2588\u2588\u2551\u2588\u2588\u2551\u2588\u2588\u2554\u2550\u2550\u255d  \u2588\u2588\u2551",
    "\u2588\u2588\u2551     \u255a\u2588\u2588\u2588\u2588\u2588\u2588\u2554\u255d\u2588\u2588\u2551 \u255a\u2588\u2588\u2588\u2588\u2551\u255a\u2588\u2588\u2588\u2588\u2588\u2588\u2554\u255d\u2588\u2588\u2551\u2588\u2588\u2551     \u2588\u2588\u2551",
    "\u255a\u2550\u255d      \u255a\u2550\u2550\u2550\u2550\u2550\u255d \u255a\u2550\u255d  \u255a\u2550\u2550\u2550\u255d \u255a\u2550\u2550\u2550\u2550\u2550\u255d \u255a\u2550\u255d\u255a\u2550\u255d     \u255a\u2550\u255d"
  ],
  "bannerFont": "ANSI Shadow"
}
